ID,Timestamp,URL,Title,Score,Comments,Text,Upvote Ratio
1jro6np,2025-04-04 22:10:58,https://www.reddit.com/r/Bitcoin/comments/1jro6np/bitcoin_for_the_win/,Bitcoin for the win!,21,10,"All this Tarif stuff just shows how essential bitcoin is. In the current circumstances, bitcoins is showing that it is truly the only way to forward irrespective of politics, demographics, and even economics. This is the uncertain future bitcoin was designed for.",0.84
1jrnsmf,2025-04-04 21:53:46,https://www.reddit.com/r/Bitcoin/comments/1jrnsmf/bitcoin_is_rome_a_thought_experiment/,Bitcoin is Rome - A Thought Experiment,1,1,"Ever think about how Bitcoin is like ancient Rome? Hear me out: Rome wasn’t built in a day. It started as a tiny city-state, slowly gaining influence, building infrastructure, and expanding its reach through innovation (roads, aqueducts, military tactics, legal systems). Similarly, Bitcoin started as a niche idea on an obscure mailing list — now it’s reshaping finance, one block at a time. Rome had no central ruler in its early Republic days. Power was distributed, decisions debated. Bitcoin is decentralized by design — no central authority, consensus-driven governance (at least ideally). It’s the closest thing we have to a digital republic. Rome spread its culture across continents. Latin influenced nearly every major European language. Bitcoin’s influence is global too — even countries with struggling economies (hello Argentina, Nigeria, Lebanon) are turning to BTC as a lifeline. Rome built infrastructure that lasted centuries. Bitcoin is building digital infrastructure — a monetary rail that’s incorruptible, transparent, and borderless. Just like Roman roads enabled commerce and communication across vast distances, Bitcoin enables permissionless financial exchange across the world. Rome had enemies, setbacks, and internal conflicts. Bitcoin’s had its own civil wars — scaling debates, forks, FUD, regulatory crackdowns. Yet it survives, adapts, and strengthens. Rome eventually fell, of course. But even its fall birthed the foundations of modern Europe. If Bitcoin ever “falls,” its technology and ideology will remain embedded in future financial systems. So yeah — Bitcoin is Rome. Not just in scale, but in spirit. What do you think? Are we living in the early Republic era of BTC, or have we already crossed the Rubicon?",0.6
1jrni68,2025-04-04 21:41:05,https://www.reddit.com/r/Bitcoin/comments/1jrni68/fud_is_getting_to_me/,FUD is getting to me,0,7,"I am worried about something - if Bitcoin undergoes a sharp loss in value, it will be more expensive to mine it than it is worth. If that happened for any length of time, it seems like a 51% attack could happen and/or the price could go to zero quickly.

I am sure someone has asked this before. Can you link me to research on this or reassure me that this is not a risk?",0.19
1jrnfu8,2025-04-04 21:38:12,https://www.reddit.com/r/Bitcoin/comments/1jrnfu8/getting_divorced_made_me_start_investing/,Getting divorced made me start investing,29,14,So it's funny I've been single for 2 months now marriage is over after wallowing like a paraplegic without a chair or arms I better myself and decided to start investing started small so far with bitcoin then see news about the stock market funny how things play out ,0.84
1jrne9w,2025-04-04 21:36:17,https://www.reddit.com/r/Bitcoin/comments/1jrne9w/help_someone_wants_me_to_buy_bitcoin_for_them/,Help someone wants me to buy bitcoin for them,0,14,"Okie basically I am 16 i got my insta banned contacted a hacker and apple paid him the amount of money i have he agreed, well then he said he needed a software to get my account to un ban, but i didnt have the money so he said how about a video of me promoting his business, i agreed then he said can i send 20$ to round up but by then i was already really sad, and even cried and told him he said its on him, then today he asked that he can send me money so i cna buy bitcoins for him, i am 16 should I please guide me please!!",0.2
1jrmxfc,2025-04-04 21:15:44,https://i.redd.it/kgi64wxowvse1.jpeg,Just leave the man alone,66,3,,0.94
1jrm062,2025-04-04 20:36:07,https://i.redd.it/smw4tbzgpvse1.png,Pretty much sums up market sentiment today...,312,8,,0.98
1jrlwou,2025-04-04 20:32:01,https://i.redd.it/nuux5bxvovse1.jpeg,"Bitcoin, short-term, does whatever you don't expect. And ironically, long-term, it does exactly what you expect.",45,5,,0.9
1jrlva3,2025-04-04 20:30:19,https://i.redd.it/wuyxoewkovse1.jpeg,FA with significant information,88,28,"This is not financial advice.  Just sharing of information.

My friend is a long term Bitcoin advocate and HODLer, who also operates a wealth mgmt practice at one of the big firms you know of.

Today, in what was otherwise a total bloodbath for global financial markets, they noticed something that completely rocked their world.

IBIT and the other spot BTC ETFs are no longer on their firm’s restricted list for purchases.

Meaning, they (and they assume the other main firms) all officially have full autonomy to invest their client assets into the spot BTC ETFs as of this week.

Which is exactly what they did today.

Further, not only is all the big money in the U.S. now readily available for BTC investment as of this week, but the spot ETFs are also releasing 60% margin.

Which signals the firm’s overall confidence in the resilience of this asset.

(They usually reduce or completely restrict margin for volatile or shaky assets)

As someone who has been in the WM / tradfi space for a long time, while feeling like they need to keep their BTC conviction to themself, I can’t tell you how incredibly shocked, relieved, and excited they are to see this development.

Again, while not financial advice, use this information as you will.  Good luck.",0.97
1jrltx8,2025-04-04 20:28:39,https://v.redd.it/oaf2g6gaovse1,Bitcoin holders watching the stock market collapse and erase $3 trillion in 2 days.,5427,288,,0.98
1jrlbo8,2025-04-04 20:07:10,https://www.reddit.com/r/Bitcoin/comments/1jrlbo8/possible_to_cancel_scheduled_send_in_strike_app/,Possible to cancel scheduled send in strike app?,0,5,"Not sure I need to, but I just sent up a send to my Trezor wallet. I followed the instructions to a T. I confirmed the address on the wallet and I scanned the QR code with the STRIKE app. STRIKE shows that it will send the sats within 24 hours, but in the trezor desktop suite it doesn’t look like I did anything. Thought I would see some kind of confirmation even if it’s a future transaction.",0.5
1jrl68h,2025-04-04 20:01:10,https://www.reddit.com/r/Bitcoin/comments/1jrl68h/bitcoin_stands_still_as_designed/,Bitcoin Stands Still — As Designed,10,6,"> Bitcoins have no dividend or potential future dividend, therefore not like a stock.

> More like a collectible or commodity.

Recent volatility in legacy financial markets has led to notable drawdowns in major indices. Equity markets have retraced significantly over the past several trading sessions.

Bitcoin has exhibited relative stability.

But price is a distraction. This is not due to intervention, liquidity injections, or central coordination. Bitcoin’s behavior reflects a system operating under fixed rules, independent of external discretion.

Block production continues at an expected interval. Issuance remains predetermined. Consensus is maintained via proof-of-work, not institutional trust.

The protocol does not respond to news cycles or macroeconomic policy. It responds to hash rate, time, and network participation.

This is not unexpected.",0.78
1jrkiq7,2025-04-04 19:33:38,https://i.redd.it/06ag4oufevse1.png,Bitcoin Distribution,259,25,,0.84
1jrjnfu,2025-04-04 18:56:53,https://i.redd.it/8hsma16x7vse1.png,Who's going to tell them?,812,161,,0.95
1jrjms1,2025-04-04 18:56:07,https://i.redd.it/h1t9y2vq7vse1.jpeg,Nasdaq and Bitcoin,208,3,"Save the your money 

BTC",0.9
1jriyrt,2025-04-04 18:27:54,https://i.redd.it/nhiz7vni2vse1.png,in a sea of BLOOD 🩸🩸 Bitcoin is the only thing GREEN today ✅📈,286,55,there is no 2nd best,0.94
1jriqtt,2025-04-04 18:18:41,https://i.redd.it/5spw02p31vse1.png,Wall Street guys be like:,632,16,,0.96
1jrico5,2025-04-04 18:02:03,https://www.reddit.com/r/Bitcoin/comments/1jrico5/first_time_this_has_happened_gold_is_down_market/,First time this has happened: Gold is down market is down and bitcoin is up,1957,313,"I don't recall a single instance where everything is crashing hard but bitcoin is rising. 

What changed? ",0.96
1jri4ij,2025-04-04 17:52:34,https://i.redd.it/axueavifwuse1.png,If you're ever going to take a meme seriously let it be this one...,127,9,,0.93
1jrhf5p,2025-04-04 17:22:42,https://i.redd.it/8c7qjn64ruse1.jpeg,Feels great to be a Bitcoiner in a Fiat world.,773,36,,0.92
1jrhdx6,2025-04-04 17:21:19,https://www.reddit.com/r/Bitcoin/comments/1jrhdx6/trump_purposely_damaged_the_stock_market_this_is/,"Trump purposely damaged the stock market, this is a demonstration of dependency",0,0,"When the FTX crashed, the Luna Coin issue, the MtGox and potentially all the meme coin scams together haven’t made so much damage in just a short period of time as the action by DJT.

If this isn’t market manipulation as it’s best I don’t know what is.

There is little what you can do other than waiting for the stock market to open to sell off your stocks to reduce your damage. Again, you depend on some institution to jump the ship as fast as possible and if you haven’t had stop loss set, you might be lucky to get out on an acceptable price.

With Bitcoin and its 24hours (that’s 2 times 12 hours for the US Americans here) trade capacity, you are in full control of the most precious asset.",0.33
1jrgoj9,2025-04-04 16:52:05,https://www.reddit.com/r/Bitcoin/comments/1jrgoj9/swapping_etfs_for_real_btc_problem_in_the_future/,Swapping ETFs for Real BTC. Problem in the future?,1,13,"Some of my holdings are in real BTC, some in ETFs.  Although the institutions say the ETFs are fully backed by BTC, what is the risk that if in the future I want to swap everything to self-custody, I will not be able to swap without significant slippage?",0.6
1jrg8z5,2025-04-04 16:34:08,https://www.reddit.com/r/Bitcoin/comments/1jrg8z5/bitcoin_at_17/,bitcoin at 17,25,12,is there anyway a 17 yo can buy bitcoin? i have no use for my money tbh and i think it’s a good idea,0.82
1jrg4ho,2025-04-04 16:29:02,https://www.reddit.com/r/Bitcoin/comments/1jrg4ho/dont_wait_for_good_news_there_is_no_good_news/,Don't wait for good news; there is no good news. Just be patient and hold.,38,13,"Everything is just a shit show. Tariffs, constant wars, inflation. There's absolutely nothing on the horizon that would be a catalyst for a positive shift in the market. 

But people are still going to need money and want that money to grow, and Bitcoin is starting to make more sense to more people as that means. 

The only good news is the momentum of Bitcoin. ",0.85
1jrfd8m,2025-04-04 15:57:46,https://i.redd.it/w8396wqybuse1.png,The situation,403,17,Resilience is the key,0.94
1jrewk3,2025-04-04 15:38:13,https://www.reddit.com/r/Bitcoin/comments/1jrewk3/how_to_withdraw_from_crypto_cap_market/,How to withdraw from Crypto Cap Market,0,3,"@crypocapmaeket
Does anyone know how to withdraw from Crypto Cap? Some of money was put into there but they didn't tell me how to withdraw to my cash app if anybody knows please let me know.",0.25
1jrer3k,2025-04-04 15:31:43,https://www.reddit.com/r/Bitcoin/comments/1jrer3k/bitcoin_might_actually_prevail/,Bitcoin might actually prevail,187,55,"I have heard sentiments on Reddit and X on how Bitcoin could increasingly become a safe-on asset.

But now I have started seeing these same ideas on institutional domain appear.

Stenos Research firm claims bitcoin fell -0,5% while the broader market plunged -5% after the tariffs in their recent article.

And highlights Bitcoin's role as a borderless asset.

I tried twice to link the article but my post gets deleted. Anyhow interesting stuff to watch unfold",0.94
1jreobd,2025-04-04 15:28:32,https://i.redd.it/1j89lpxq6use1.jpeg,No tariffs on bitcoin ⚡,29,2,,0.94
1jreisj,2025-04-04 15:22:17,https://www.reddit.com/r/Bitcoin/comments/1jreisj/im_a_broke_college_student_19_years_not_trying_to/,Im a broke college student 19 years. not trying to miss out on this opportunity. Will the market still be low by the summer when I can work?,0,23,Title ,0.18
1jreet8,2025-04-04 15:17:41,https://www.reddit.com/r/Bitcoin/comments/1jreet8/gemini_locked_my_account_liquidated_my_assets_and/,"Gemini Locked My Account, Liquidated My Assets, and Is Now Ignoring Me – What Can I Do?",6,10,"I’ve been locked out of my Gemini account for over a month with no clear explanation. Support initially told me they were working on it “urgently,” but they’ve been vague, unhelpful, and now completely unresponsive for the past several days.

	•	My assets were liquidated due to an overdue balance that I couldn’t pay because my account was locked.
	•	I can’t access my tax documents, which I need ASAP.
	•	Gemini won’t give me a timeline or even confirm if my remaining funds are safe.

At this point, I’m concerned about my money and their lack of transparency. Has anyone else experienced this? Any advice on how to escalate this further?

I’ve already emailed multiple times, posted on X, and I’m considering filing complaints with CFPB, NYDFS, and the SEC.

If you have funds on Gemini, be careful. This kind of behavior is a huge red flag.

#Gemini #Crypto #ScamAlert",0.6
1jre3qi,2025-04-04 15:04:58,https://bitinfocharts.com/bitcoin-distribution-history.html,Bitcoin Distribution,16,11,"100 BTC to 1 Million BTC = top 0.03%

10 BTC to 1 Million BTC = top 0.28%

1 BTC to 1 Million BTC = top 1.83%

0.1 BTC to 1 Million BTC = top 8.2%

0.01 BTC to 1 Million BTC = top 22.75%

0.001 BTC to 1 Million BTC = top 43.97%

0.0001 BTC to 1 Million BTC = top 68%

0.00001 BTC to 1 Million BTC = top 88.53%


https://bitinfocharts.com/bitcoin-distribution-history.html",0.83
1jrduzr,2025-04-04 14:55:04,https://www.reddit.com/r/Bitcoin/comments/1jrduzr/bitcoin_beating_the_market/,Bitcoin beating the market!,1000,169,"The market is totally tanking today, but not bitcoin! Is it finally separating itself and no longer mirroring price trends of broader markets? ",0.9
1jrbojy,2025-04-04 13:19:08,https://www.reddit.com/gallery/1jrbojy,Your Daily Bitcoin Breakdown newsletter is now live. Check out today’s Top Stories and a sneak peek at the latest Quick Bits snippets. Full issue link is in the comments.,19,2,,0.84
1jrbasx,2025-04-04 13:01:02,https://bitcoinops.org/en/newsletters/2025/04/04/,Bitcoin Optech Newsletter #348,6,1,,0.73
1jrai8m,2025-04-04 12:20:30,https://www.reddit.com/r/Bitcoin/comments/1jrai8m/how_can_be_there_multiple_master_public_key/,How can be there multiple master public key?,0,2,"I entered a bip39 wallet seed into Electrum, then copied the master public key. But it seems when I repeat the process, the master public key is not the same at all. Is it supposed to do that? (I can't see the transaction on the other master public key)",0.43
1jra8y3,2025-04-04 12:06:59,https://cointelegraph.com/news/ai-firm-genius-group-orced-sell-bitcoin-treasury,Who?,0,1,"""Genius Group says it’s been banned from buying more Bitcoin.

The preliminary injunction blocking Bitcoin purchases is connected with a broader dispute surrounding a merger with Fatbrain AI that went sour in October last year.""

This shit is about to explode. ",0.33
1jra8uz,2025-04-04 12:06:52,https://i.redd.it/5uiqvupr0tse1.png,Inventory of known Bitcoin scam,19,7,"So I'm making a small inventory of well-known and less known Bitcoin scam, mostly so people know about them and avoid them.

* Scam 1 : The scammer sends some phishing email where he/she pretends to be someone from Ledger/Trezor/whatever. They warn the victim that their crypto are in danger and should be moved to a new address asap. The victim, if gullible and owner of a Ledger/Trezor/whatever, can fall for the trap and transfer their crypto to the address provided by the scammer.
* Scam 2 : Similar to scam 2, but instead of requiring that the Bitcoin be moved to a new address, the scammer says that the victim should give them their 12/24 words so they can protect the funds. You know the rest.
* Scam 3 : The scammer and the victim take contact in some p2p website for selling/buying bitcoins. The victim sends, let's say, 400$ to buy Bitcoins. The scammer doesn't receive the 400$ for now because they are held in escrow by the p2p website until the victim receives the BTC. The scammer sends the BTC to the victim's address but with a fee way too low for the transaction to be confirmed anytime soon. The transaction still appears in the victim's wallet as pending/unconfirmed. The unaware victim tells the p2p website that they receive the BTC. The p2p website sends the 400$ to the scammer. The scammer broadcasts a transaction where the exact same UTXO he sent the victim is now sent to himself, with a high fee, making the original transaction illegal on the blockchain. The victim never receives the BTC.
* Scam 4 : Very similar to scam 3, but this time, the scammer, still with a way too low fee, sends 4000$ in BTC to the victim (they ""inadvertently"" removed a zero after the decimal place). They ask the victim to please send them back 3600$ in BTC. The victim does. Once the scammer receives the 3600$ in BTC, they do exactly the same as in Scam 3.
* Scam 5 : With an AI, the scammer produces a video of Michael Saylor or whoever pretending that this is some kind of time-limited game where he will double any amount of BTC sent to some address. You know the rest.
* Scam 6 : Pig butchering : The scammer (a young girl in some Asiatic country) takes contact with a lonely and rich occidental man. They progressively gain the trust of the victim and convince them to buy some BTC over some legal platform (Kraken, coinbase, whatever). Then, the victim is convinced to send the BTC to some platform for some miraculous investment. Of course, the platform is a fake. You know the rest.

  
If you can think of any scam different to the ones listed above, please share. And for the sake of your coins, think before you take action. Always.",0.74
1jr9uym,2025-04-04 11:45:35,https://www.reddit.com/r/Bitcoin/comments/1jr9uym/should_i_do_it/,should I do it,55,64,I’m 18 years old and would like to start investing in bitcoin should I go for it now or is it safe to wait for a couple more years ?,0.81
1jr9u28,2025-04-04 11:44:07,https://www.reddit.com/r/Bitcoin/comments/1jr9u28/strike_wont_release_my_funds/,Strike won’t release my funds,8,27,"Strike is holding my sats hostage until I deposit more money. 

I’ve been buying on Strike for a few months now, no issues. Until now. A few days ago, I tried to buy $1000 worth of bitcoin on Strike. I used the linked bank account as i did the times before. 
However, this time I got an error message that the purchase failed. No big deal right?  So I tried again with $1000. It failed again!  Now I’m thinking that maybe I have a bad signal, so I move and try it again. This time I tried with $2500 (I was going to use it all for bitcoin anyway). This went through!  Yay right?
Later in the day, I find that all 3 purchases had gone through on the app, even though it initially showed that the first 2 purchases had failed. Now, I have @$4500 worth bitcoin. But I only ever had $2500 to spend. I somehow double spend. Twice. Now, Strike won’t release my $2500 worth of bitcoin until I deposit an additional $2000, so the can sell me $4500 worth instead of the intended $2500. 
I’ve been in contact with “Charles” at Strike via the in-app messaging. He’s been polite but unhelpful. The last message was simply that my funds are ”frozen” until I deposit an additional $2k. I informed him I won’t have any more money until the end of April. I spend everything I have on necessities and bitcoin. I don’t have an extra 2k. I’ve been ghosted. I asked for advice on how we should handle it and Charles ghosted me. No communication at all after my last message 2 days ago. 
Any advice?  Has this happened to anyone before with Strike or any other platform?  Strike is essentially holding someone else’s $2k bitcoin with my $2.5 bitcoin, and I have until April 20 to buy the rest. Not sure what happens to my $2.5k after that date, never got an answer from “Charles”. 

Update - Strike has been in contact. The funds are still currently frozen, but it was a legitimate Swiss-cheese-theory event, and the funds will be available when I can actually buy them. The lesson here is not to trust tech too much. I had 2 seeming failed attempts at buying bitcoin and a third successful. But then they were all successful and I bought twice as much bitcoin as I intended, putting me in the proverbial pickle. My best solution would have been for Strike to simply take back the bitcoin that was purchased by error, but as it stands, my bitcoin is still with Strike and will be available whenever I can pay for it (at the price at the time of the erroneous purchase). ",0.6
1jr913f,2025-04-04 10:54:04,https://www.reddit.com/r/Bitcoin/comments/1jr913f/how_do_you_feel_about_mstr/,How do you feel about MSTR,1,0,Genuinely looking for crypto bros takes on if this is a valid company doing good or bad for BTC in the long run. ,1.0
1jr8xh8,2025-04-04 10:47:29,https://www.reddit.com/r/Bitcoin/comments/1jr8xh8/stumbled_upon_a_usb_drive_from_a_storage_unit_i/,Stumbled upon a USB drive from a storage unit i bought.,0,11,Hello guys . I stumbled upon a usd drive from a storage unit i bought . It had also a mining rig  and seems to have been abandoned . Is there a way to withdraw the BTC? Do i need anything,0.46
1jr7nyt,2025-04-04 09:18:45,https://www.reddit.com/r/Bitcoin/comments/1jr7nyt/what_does_mbtc_mean/,what does mBTC mean?,12,17,"i have seen some website say that mBTC means milibitcoins while others say that it means micro bitcoin, so what mBTC mean",0.73
1jr7996,2025-04-04 08:48:30,https://www.reddit.com/r/Bitcoin/comments/1jr7996/money_coming_out_of_the_stock_market_will_be/,Money coming out of the stock market will be going somewhere…,249,201,"This is just one man’s opinions so everyone pls chill TF out. 🙏
I’ve been in crypto for nearly 10 years now and this is my GUT FEELING (not financial advice or whatever)

The market is collapsing and there is more or less only 3 options for those that are pulling out of stocks (a few $trillion already)

Gold/precious metals (which is safe but already seems expensive)

Cash (losing money and increasingly unstable)


Bitcoin/crypto…



Right now may be the start of a historic BTC bull run. It could go parabolic until there’s renewed confidence in global trade. (6 to 18 months at a guess)
",0.82
1jr6uia,2025-04-04 08:17:01,https://www.reddit.com/r/Bitcoin/comments/1jr6uia/what_are_the_podcasts_to_increase_knowledge_about/,What are the podcasts to increase knowledge about crypto & bitcoin,14,42,"I am fairly new & have some very basic knowledge… what are your go to podcasts to improve knowledge. Any other recommendations are welcome as well.

Thanks in advance. 

Ps what i got & will strongly follow from my beginner learning is HODL ",0.78
1jr5kwj,2025-04-04 06:44:48,https://i.redd.it/nd0qmpnalrse1.jpeg,Bitcoin Network Hashrate Hits an All Time High 🔥📈,228,7,,0.96
1jr5hkf,2025-04-04 06:38:33,https://www.reddit.com/r/Bitcoin/comments/1jr5hkf/how_is_btc_not_dropping_right_now/,How is BTC not dropping right now?,940,519,"Given the tariff announcements yesterday and the biggest stock market drop since 2020, how is bitcoin still holding at $83k???

Thoughts? I presume it was already priced in?

Very bullish sign imo",0.92
1jr4ymg,2025-04-04 06:02:56,https://www.reddit.com/r/Bitcoin/comments/1jr4ymg/daily_discussion_april_04_2025/,"Daily Discussion, April 04, 2025",29,165,"Please utilize this sticky thread for all general **Bitcoin** discussions! If you see posts on the front page or /r/Bitcoin/new which are better suited for this daily discussion thread, please help out by directing the OP to this thread instead. Thank you!

If you don't get an answer to your question, you can try phrasing it differently or commenting again tomorrow.

Please check the [previous discussion thread](https://www.reddit.com/r/Bitcoin/comments/1jqbwi0/lightning_thursday_april_03_2025_explore_the/) for unanswered questions.",0.91
1jr4oua,2025-04-04 05:45:18,https://www.reddit.com/r/Bitcoin/comments/1jr4oua/my_cousinbest_friend_is_giving_birth_to_a/,"My cousin/best friend is giving birth to a daughter today. I'd like to give her the seed to a wallet that unlocks in 20 years and keep another seed that could access the bitcoin at any time. Can such a wallet exist and be generated in a way that's easy, safe and timeproof?",3,17,"First kid on this side of the family! A 1,000€ investment that will hopefully turn into a small nest egg for her entry into adulthood in 20 years.",0.58
1jr4jt0,2025-04-04 05:36:09,https://i.redd.it/elc1nbl19rse1.jpeg,Prediction For This Quarter? 👇,64,20,,0.89
1jr4hy5,2025-04-04 05:32:53,https://i.redd.it/qywizql58rse1.jpeg,Bitcoin Activity Is Heating Up 📈,51,1,,0.94
1jr4dlp,2025-04-04 05:25:08,https://www.reddit.com/r/Bitcoin/comments/1jr4dlp/do_u_compare_the_value_of_btc_to_other_currencies/,Do u compare the value of BTC to other currencies than the dollar?,9,15,Lately the dollar has lost a lot of value. Still BTC/dollar has not increased..,0.75
