ID,Timestamp,URL,Title,Score,Comments,Text,Upvote Ratio
1jxi0mb,2025-04-12 14:03:24,https://www.reddit.com/r/Bitcoin/comments/1jxi0mb/its_time_to_leave_people_in_the_dust/,It's time to leave people in the dust,7,2,Three two one blastoff,0.89
1jxi09h,2025-04-12 14:02:55,https://www.reddit.com/r/Bitcoin/comments/1jxi09h/people_who_is_waiting_for_50000_will_have_to_buy/,People who is waiting for $50.000 will have to buy at $100.000.,25,13,"Believe or not, its up to you. ",0.72
1jxge3h,2025-04-12 12:40:36,https://www.reddit.com/r/Bitcoin/comments/1jxge3h/peter_mccormick_and_bedford/,Peter McCormick and Bedford,1,1,"Peter McCormack is trying to make Bedford a bitcoin hub, which is good. I was just wondering with all the establishments he has set up over there,  football club, coffee shop and pub. 

Does he have something set up where you can walk in and buy bitcoin no kyc or no questions asked?",0.6
1jxfx9x,2025-04-12 12:14:30,https://youtu.be/ZIktba-8bTM?si=nCAOAHMRWVGI14sC,I remember this being the first time I heard about Bitcoin and thinking it was to late to invest...,0,1,,0.5
1jxf37a,2025-04-12 11:23:10,https://www.reddit.com/r/Bitcoin/comments/1jxf37a/early_bitcoiners/,Early Bitcoiners,24,36,"I can imagine early bitcoins who have two, three or more digit bitcoins are probably happy with their stack and not really considering DCA, since they get way less than they got years ago.

What do you think? If you had 10, 20 or more BTC you would just sit on these like a hen and chill.",0.84
1jxeotm,2025-04-12 10:57:54,https://www.reddit.com/r/Bitcoin/comments/1jxeotm/btc_tracker_is_live/,BTC Tracker is live!,31,3,"Hi everyone, 

yesterday I released first version of my self-hosted BTC Tracker. After launch I've seen some issues + I already had 2 PRs ready for authentication and GH pages. Now it's realesed.

Feel free to play around, leave insights, issuses or request for the new features.

Project page: [https://wilqq-the.github.io/BTC-Tracker/](https://wilqq-the.github.io/BTC-Tracker/)  
Repo: [https://github.com/wilqq-the/BTC-Tracker](https://github.com/wilqq-the/BTC-Tracker)

https://preview.redd.it/1jbevc5qxdue1.png?width=1289&format=png&auto=webp&s=707e4b741304294b8d06bac091827924a0baac7c

",0.91
1jxeeme,2025-04-12 10:38:24,https://www.reddit.com/r/Bitcoin/comments/1jxeeme/bills_with_bitcoin/,Bills With Bitcoin,3,12,So I have a question that I’m trying to wrap my mind around the answer. I currently have X amount of dollars in bills a month. Have a job to where I can easily pay these bills monthly and save 20 percent of paycheck a week. Which is DCA’d daily into Bitcoin. I’m guess I’m trying to justify in my brain how to DCA more into Bitcoin by taking the amount of money I owe a month on bills plus the 20 percent I already DCA daily and when a bill comes due it comes out of my bank account and then I sell those Sats to replace what was taken out of my bank account. In theory and the long run I would have more SATS than if I just did 20 percent DCA. Can anyone please let me know if this is viable? I know there will be a Bear market where I will be losing money in the short term but at the same time I will be lowering my dollar cost average doing it this way. ,0.72
1jxdhos,2025-04-12 09:30:53,https://www.reddit.com/r/Bitcoin/comments/1jxdhos/can_you_keep_selling_your_cheap_sats_m2_is/,Can you keep selling your cheap sats? M2 is exploding and I will sell you back in few months,26,10,Thanks for the cheap sats the last 2 weeks guys ,0.76
1jxdbmv,2025-04-12 09:18:22,https://v.redd.it/n9s2qv2rfdue1,This point of sale device takes bitcoin or fiat (and I paid with a ring),60,28,I am Not sponsored or affiliated by any bitcoin payment devices or water bottle companies. ,0.85
1jxcxwn,2025-04-12 08:50:01,https://www.reddit.com/r/Bitcoin/comments/1jxcxwn/how_much_btc_do_you_have/,How much BTC do you have?,0,28,"I know people will say: don’t share how much Bitcoin you have but when I am reading everyone’s posts here I always wonder:
Do they have:
- 100 BTC
- 10 BTC
- 1 BTC
- 0,5 BTC
- 0,1 BTC
Etc

Somehow wanting to see where I rank with my btc saving. 

Am I the only one who thinks like that and is curious like that?",0.15
1jxcwp3,2025-04-12 08:47:27,https://i.redd.it/9hn0w4bhadue1.jpeg,Bitcoin is not just a store of value — it's a solution to many financial problems.,53,4,"Tired of dealing with frozen funds, random account locks, and terrible customer service from companies like PayPal and traditional banks? Bitcoin offers a reliable, decentralized alternative where you’re in full control of your money. No bank holidays. No unexplained holds. No middlemen. Just financial freedom",0.93
1jxcjtv,2025-04-12 08:20:48,https://www.reddit.com/r/Bitcoin/comments/1jxcjtv/saving_in_bitcoin_vs_saving_in_etf/,Saving in Bitcoin vs. saving in ETF,11,10,"Hey guys, so i got into an argument with a fiat lover friend, and was advocating for a hard money standard and stating that one part of housing becoming increasingly expensive is that people are saving their wealth in real estate, that is hard to create, with credit that is made out of basically magic dust. He argued that you could use diluted ETFs like MSCI World that everyone with a bank account could save in and still outperform inflation and build up wealth. I argued that we (in germany) have 25% taxes on capital gains which would not be there if we could save in euro. I struggled to find other points that are not about things like state control or anonymity. What do you think are benefits of hard money compared to ETFs? Or why would you say bitcoin is superior in a financial sense? Thanks for your ideas.",0.8
1jxcg1k,2025-04-12 08:12:40,https://www.reddit.com/r/Bitcoin/comments/1jxcg1k/how_btc_knowledge_transformed_my_whole_investment/,How $BTC knowledge transformed my whole investment perspective,23,7,"Six years ago I was living paycheck to paycheck with crushing student debt. Today, I'm debt-free with a healthy portfolio and actual savings. All thanks to taking a chance on Bitcoin.
I still remember my coworker talking about crypto back in 2017 and me laughing it off as internet funny money. After weeks of him showing me charts and explaining the technology, I reluctantly threw in $500 I could barely afford just to shut him up.
Best decision of my life.
That initial investment turned into my obsession. I started researching everything I could about blockchain, decentralization, and investment strategies. I set up automatic weekly buys with whatever I could spare ($20-50). Those small consistent purchases added up more than I ever imagined.
When the 2021 bull run hit, my portfolio exploded. I was smart enough to take some profits (paid off $23k in student loans) but kept most invested. Even through the crash and bear market, my average buy price kept me well in the green.
But the biggest change wasn't just financial - Bitcoin completely shifted my mindset. I went from someone who couldn't save a penny to someone thinking about long-term wealth building. I started learning about traditional investing, opened a Roth IRA, and even got serious about my career to increase my income.
For anyone on the fence about crypto - I'm not saying throw your life savings in. But the journey of learning and small consistent investing changed everything for me.
Anyone else have life-changing experiences with Bitcoin?
EDIT: Thanks for the awards and all the responses! Didn't expect this to blow up lol",0.96
1jxc9s1,2025-04-12 08:00:08,https://www.reddit.com/r/Bitcoin/comments/1jxc9s1/thanks_guys/,Thanks guys!,59,30,"In for 5 weeks. Have been reading a lot here. I think i'm set now, and i love it..  thanks to you guys..!

Hourly DCA with Strike -
Auto withdrawal to Trezor -
Seed words on steel plate -
Only told my wife in case I die..

Now let it slowcook for 15 years..

Thanks for the advice everyone! 
",0.94
1jxc699,2025-04-12 07:53:02,https://i.redd.it/weshc3qr0due1.jpeg,☯️,44,1,,0.96
1jxam77,2025-04-12 06:02:54,https://www.reddit.com/r/Bitcoin/comments/1jxam77/daily_discussion_april_12_2025/,"Daily Discussion, April 12, 2025",18,32,"Please utilize this sticky thread for all general **Bitcoin** discussions! If you see posts on the front page or /r/Bitcoin/new which are better suited for this daily discussion thread, please help out by directing the OP to this thread instead. Thank you!

If you don't get an answer to your question, you can try phrasing it differently or commenting again tomorrow.

Please check the [previous discussion thread](https://www.reddit.com/r/Bitcoin/comments/1jwj2fe/daily_discussion_april_11_2025/) for unanswered questions.",0.93
1jx8wqq,2025-04-12 04:13:54,https://www.thestreet.com/crypto/markets/surprising-china-news-sends-bitcoin-reeling-to-84k,Surprising China news sends Bitcoin reeling to $84K,0,7,,0.38
1jx8t6r,2025-04-12 04:07:59,https://www.reddit.com/r/Bitcoin/comments/1jx8t6r/new_invester/,New invester,10,16,"Hey, I'm 18 and I'm starting to get into Bitcoin and stocks. I've but down $10.30 on Bitcoin and $5 on SPDR Gold Trust. 

To be honest, I have no clue or knowledge on what I'm doing. I would like to though. If someone could give me some tips or even kinda train me, it would be much appreciated. ",0.75
1jx7xrk,2025-04-12 03:16:01,https://www.reddit.com/r/Bitcoin/comments/1jx7xrk/what_is_a_good_app_to_buy_btc_then_transfer/,"what is a good app to buy btc, then transfer?",17,39,"i have a leverage trading account i want to deposit more funds into. i’ve been using an app that lets you buy btc with cash at a coinstar. it works great, but recently they starting having MONSTER fees. we’re talking $920 deposit to get $820 into account. what can I use, to buy and transfer btc? thank you in advance.",0.77
1jx6z1r,2025-04-12 02:21:15,https://i.redd.it/0s5g5cpkdbue1.jpeg,The 8th Year of ELLiPAL,7,4,It’s not easy to keep,0.71
1jx5ycr,2025-04-12 01:24:59,https://bitcoinops.org/en/newsletters/2025/04/11/,Bitcoin Optech Newsletter #349,8,1,,0.8
1jx5wiz,2025-04-12 01:22:15,https://www.reddit.com/r/Bitcoin/comments/1jx5wiz/youre_still_early_a_long_form_post_as_part_of_a/,"""You're still early"" (a long form post as part of a Bitcoin book project)",26,7,"A section I drafted as part of a small book about Bitcoin for newbs. All feedback welcome!  
\_\_\_\_\_\_\_\_\_\_\_\_\_\_\_

  
The Bitcoin community points out that newcomers often think they’re too late. People considering Bitcoin for the first time look at the price history and think they missed their chance. Similarly, especially during Bitcoin’s most exciting times, people look at the price and think, “it’s too expensive”.

The funny thing is, that’s been true since before 2013 and a $90 price. I know because I had those same thoughts back then. And I expect people to have similar thoughts at $125,000 and then at $250,000 and then at $500,000.

One Bitcoin went from buying 2 Big Macs in 2012 to over 11,000 Big Macs in 2024. It went from needing 28,000 Bitcoin to buy a typical house in 2012 to just 6 in 2024. That’s a huge jump but it’s also an ongoing trend – there’s still a lot of room for Bitcoin to grow even more in the future.

New technologies tend to follow a predictable adoption curve, starting with a small group of innovators and early adopters before gaining traction with the broader public as things improve.

In 1994 Bryant Gumbel, a host of the popular Today Show, stumbled through trying to understand an email address. Bryant asked, “What is internet anyway?”

His co-host, Katie Couric, responded, “Internet is that massive computer network, the one that’s becoming really big now”. Bryant asked, “What, do you write to it, like mail?”

The next year, famous comedian David Letterman had Bill Gates on his late night talk show. Letterman asked, “What about this internet thing, do you know anything about that?”. Bill Gates said, “Sure,” and talked a bit about how it lets people publish information and send email. Letterman poked fun at Gates the entire time. 

When Gates talked about the ability to listen to a baseball game online, Letterman jokingly asked, “Have you heard of radio? Do tape recorders ring a bell?” Gates went on to describe the most basics of social networking. By that point Letterman was laughing in his face and the crowd laughed along.

In those days the Internet was an emerging technology, not yet mainstream. I remember reading business magazines at the time – printed on paper. They had articles with titles like, “Is it time for you to put your business online?” Then the entire article would explain all the reasons you shouldn’t bother to have a website for your business.

In 1998, Paul Krugman, a distinguished professor of economics, said:

***The growth of the Internet will slow drastically, as the flaw in 'Metcalfe's law'–which states that the number of potential connections in a network is proportional to the square of the number of participants–becomes apparent: most people have nothing to say to each other! By 2005 or so, it will become clear that the Internet's impact on the economy has been no greater than the fax machine's.***

Ok, it can be fun to look back at the early days of things and poke fun at the people who didn’t understand what was coming. 

But it’s also educational to look at how society initially reacts to new, unfamiliar things as they emerge and grow. There is always a some amount of fear, uncertainty, and doubt around new things.

In 1995 the internet had about 16 million users. That was about 0.3% of the world’s population at the time. Ten years later (2005) it was a bit over 1 billion users, or about 15% of the world’s population. Another ten years (2015) got it to well over 3 billion users, 43% of world population. Today the internet has more than 5 billion users which is about 66% of the world’s population.

The internet is not the only interesting new technology we can look at. Here are two others that made history:



**Credit Cards** 

The idea of a small plastic card that lets you charge purchases started in the 1970s. Before 1980 credit cards were owned by about 50 million users worldwide. That was about 2% of the worldwide adult population at the time. By the end of the 1980s they were used by about 150 million people, or about 5% of the world’s adult population.

In 1993 a local TV news station went into a Burger King restaurant in the US. The restaurant had just started accepting credit cards. The news station asked customers what they thought about using credit cards to buy Burger King food. 

One customer said, “I think it’s pretty bad if you have to use a credit card when you go to a fast food restaurant,” and then expressed concern that someone would have to “call New York” to confirm the transaction. Another customer said, “I just hope it doesn’t slow things down.” A third customer, a gray haired gentleman dressed in a suit and tie, said, “I just can’t imagine it working on a day-to-day basis.”

About 400 million people owned credit cards at the time, or about 10% of adults worldwide (100 million in the US, or about 53% of adult Americans).

From there usage steadily increased. Today credit cards are used by about 1.2 billion people, about 22% of adults worldwide (200 million in the US, or about 80% of adult Americans).



**Smartphones**

In 1992, Andy Grove, CEO of Intel, described the idea of a wireless personal communicator in every pocket as ""a pipe dream driven by greed"". The first smartphone was released back in 1994 but only got about 50,000 users.

But in 2007 the iPhone came out and the overall market quickly got to 122 million users worldwide, or about 1.8% of the world’s population. Microsoft's CEO at the time, Steve Ballmer, stated: ""There's no chance that the iPhone is going to get any significant market share.""

By 2015 the overall smartphone market was at 2.6 billion users worldwide, or about 35% of world population. Today we’re looking at almost 7 billion users, about 84% of the planet.



That’s a basic review of several technologies that emerged in the past. How does Bitcoin compare?

It can be difficult to pin down exactly how many people own Bitcoin today. But specialists at companies like Chainalysis study data from Bitcoin apps and conduct surveys to count users in the US and worldwide. They report that about 300 million people own Bitcoin today. That’s about 3.7% of the world’s population.

That’s roughly similar to 1980 for credit cards. Or the late 90s for the internet. Or about 2009 for smartphones.

Most people in the world don’t own any Bitcoin yet. Big companies and even governments are just now starting to take it seriously. 

We recently passed the stage where Steve Balmer the CEO of Microsoft said, ""There's no chance that the iPhone is going to get any significant market share."" We’ve just barely reached the stage where David Letterman laughed at Bill Gates and suggested the internet was no more useful than radio and tape recorders. We’re not yet at the stage where a Burger King customer looked at the restaurant’s new credit card readers and said, “I just can’t imagine it working on a day-to-day basis”.

There’s a long way to go before Bitcoin *really* catches on.

You’re not late.   
  
You’re early.",0.82
1jx48to,2025-04-11 23:55:04,https://i.redd.it/99ew2xohnaue1.jpeg,Is fiat dead? Are we expecting a bump soon? Is anyone buying the dip?,469,90,,0.87
1jx2g4g,2025-04-11 22:27:49,https://i.redd.it/p2f42huv7aue1.png,"While you're sitting there wondering if you should buy, your USD just lost 4-5% of its value",277,50,,0.94
1jx2bl6,2025-04-11 22:21:59,https://www.reddit.com/r/Bitcoin/comments/1jx2bl6/income_and_bitcoin/,Income and Bitcoin,16,29,"Apart from Strategy dividends and Bitcoin jobs, how can someone live off of Bitcoin? 
I've heard of taking loans/credit against it but I'm yet to understand how. Anyone who can give insights into this?",0.86
1jx1ve9,2025-04-11 22:01:21,https://www.reddit.com/r/Bitcoin/comments/1jx1ve9/2of3_multisig_xpub_backup_as_mnemomic/,2of3 multisig xpub backup as mnemomic,0,1,"I read, to transact it is necessary to back up the multisig secret keys and all three extended public keys.

In case i would like to have the xpubs engraved in metal together with each of the secrets.
Is it possible to encode the xpub as mnemonic in words from bip39?

English words are human readable and error prone when recovering, then a string of non-mnemomic letters and numbers.

Otherwise the xpub could be stored digitally, but I would like to avoid that.",0.5
1jx1hd3,2025-04-11 21:43:47,https://v.redd.it/jeem71010aue1,"CPI, inflation, GDP growth below expected. Unemployment, 10y yields above. You know what happens next",386,48,,0.96
1jx03d7,2025-04-11 20:42:46,https://v.redd.it/b141hmp5p9ue1,"Are you ready, kids?",1029,84,,0.96
1jx02wv,2025-04-11 20:42:12,https://www.mitrade.com/insights/news/live-news/article-3-753130-20250411,Florida’s Bitcoin Reserve Bill Unanimously Passes Subcommittee Vote,6,0,,0.88
