ID,Timestamp,URL,Title,Score,Comments,Text,Upvote Ratio
1judtfd,2025-04-08 13:40:24,https://abcnews.go.com/Politics/trump-admin-tells-prosecutors-ease-crypto-enforcement/story?id=120589406,Trump admin tells prosecutors to ease up on crypto enforcement,3,0,"The Trump administration is pulling back its enforcement of crypto regulations, disbanding a unit dedicated to cryptocurrency enforcement

The Justice Department instructed federal prosecutors to ""no longer target virtual currency exchanges, mixing and tumbling services, and offline wallets for the acts of their end users or unwitting violations of regulations,"" according to a memo from the U.S. deputy attorney general reviewed by ABC News.

""The Department of Justice is not a digital assets regulator,"" the memo said. ""The National Cryptocurrency Enforcement Team (NCET) shall be disbanded effective immediately.""",0.71
1jud0uj,2025-04-08 13:02:39,https://fortune.com/crypto/2025/04/08/doj-ncet-disbands-memo-todd-blanche-trump/,Justice Department scraps crypto unit as Trump further loosens oversight of digital assets,128,13,,0.91
1jucz2z,2025-04-08 13:00:33,https://v.redd.it/mcwomszxzlte1,"REMINDER: 🟠 “Don't sell your #Bitcoin. It's going to be very hard to get it back.""

- Eric Weiss",368,77,,0.91
1jucmxw,2025-04-08 12:43:32,https://www.reddit.com/r/Bitcoin/comments/1jucmxw/heres_a_brain_buster_for_the_smart_ones_here/,Here's a brain buster for the smart ones here...,5,24,"Do I have a higher chance spinning the Fold sats wheel to win a Bitcoin or solo mining a with a bitaxe

I work at Wendy's so this is beyond my comprehension ",0.63
1juc3y8,2025-04-08 12:16:13,https://www.reddit.com/r/Bitcoin/comments/1juc3y8/how_do_i_send_someone_btc_from_coinbase_to_bitpay/,How do I send someone BTC from coinbase to Bitpay?,0,6,I need to send someone a few hundred bucks in btc but they have BitPay. Im gonna buy the amount on coinbase but how do I send to Bitpay?,0.5
1jubgxm,2025-04-08 11:41:40,https://www.reddit.com/r/Bitcoin/comments/1jubgxm/first_transaction_completed/,First transaction completed,20,3,"I figured it could be a good time to move out from the exchange and get more familiar with the network, turns out it's surprisingly easy to use considering the complexity of the things to assimilate in order to understand how things work, but it went smoothly without any issue. Also I already knew it but I now have the confirmation that my money went into BTC and didn't vanish ;)

  
Time to hodl",0.85
1jubejp,2025-04-08 11:37:34,https://i.redd.it/mgngw1p6llte1.jpeg,Remember this in these dark times,915,45,,0.95
1jub78u,2025-04-08 11:25:39,https://www.reddit.com/r/Bitcoin/comments/1jub78u/btc_in_fidelity_crypto_roth_ira/,BTC In Fidelity Crypto Roth IRA,4,5,I’m 100% in on BTC. Most of my allocation is in my cold wallet. Recently I moved all of my Fidelity Roth IRA into a Fidelity Crypto Roth IRA and went 100% BTC there. What I really wanted to do was withdraw the Roth IRA completely to my bank account and then buy back the BTC my usual/safe way - but I am concerned about the large penalty hit of doing that. I’m wondering if there are any loopholes or savvy strategies for getting that BTC out of my Roth IRA without getting hit with a penalty. I am still about 20 years out from retirement so I can’t make penalty-free withdrawals. My concern is not having the total ownership to this portion of my BTC for the next 20 years. ,0.67
1jub136,2025-04-08 11:15:09,https://youtu.be/WePHb7rnGBo,Bitcoin as a Risk-Off Asset? V Shape Recovery?,0,0,,0.5
1juatud,2025-04-08 11:02:44,https://www.reddit.com/r/Bitcoin/comments/1juatud/built_a_bitcoin_inheritance_tool_for_my_family/,Built a Bitcoin inheritance tool for my family after turning 40. Honest feedback needed.,0,40,"Hey everyone,

I’m Umut Kundukan, a developer for almost 20 years. After turning 40, I started thinking more seriously about what would happen to my Bitcoin if something happened to me.

While looking for a proper inheritance solution, I came across the usual suggestions. These included sharing your seed phrase with someone, trusting a custodian with sensitive info, or relying on random centralized services. None of that felt right to me. I found it disturbing how often the advice boiled down to “just give someone access.”

So I decided to build something myself.

Over the last 9 months, I’ve been working on a tool with a few old friends. It is called BitInPeace, and it is meant for long-term holders like me who want to protect their loved ones without giving up sovereignty or privacy.

Here is how it works in short:  
You create and store a signed Bitcoin transaction that would send your BTC to a backup address, but only if you become inactive.  
The system monitors wallet activity. If you stay inactive past the time you set, the transaction gets broadcast. **No private keys are ever accessed. Only your signed transaction is stored.**

To make it easier to try, we also support wallets that allow signing and broadcasting separately.  
We have tested with Ledger, Trezor, Unisat, Exodus, and Phantom. You can even use a burner wallet and load it with a small amount (like 0.0002 BTC) to try it out without putting any real funds at risk.  
Just to be clear, I have no affiliation with any of these wallets.

If you decide to try it, you will be asked for credit card details, but nothing is charged upfront. It just starts a free trial, and you can cancel right after testing it. If anything feels off, just message me and I will make sure you are not billed.

I also recorded a short demo video showing how it works with a burner wallet. If it is okay, I will share the link in a comment.

I am not here to pitch anything. I would really like to hear your honest feedback. If you have thoughts on the idea, the experience, or anything that could be improved, I am all ears.

**The mods kindly allowed me to post this once.** I appreciate the opportunity and totally understand the need to be careful.

Normally I use anonymous accounts everywhere, but I am using this one to be transparent.

Thanks for reading. I really appreciate your time and any feedback you are willing to share.",0.4
1juaqxr,2025-04-08 10:58:12,https://www.reddit.com/r/Bitcoin/comments/1juaqxr/bitcoin_is_much_more_resilient_this_cycle/,Bitcoin is much more resilient this cycle.,637,124,"I started buying Bitcoin back in 2020, then went heavy on it in 2021. It was *crazy* volatile back then. China just dropped news about banning Bitcoin and boom—price tanked 50%, just from an announcement. No real action, just pure FUD.

Fast forward to now, we’ve had global market chaos, but Bitcoin only dipped like 30% max from ATH. It’s holding up way better than ever before—feels way less shaky this time around.

Good times are coming. Bitcoin’s gonna teleport in price before we even realize it. Right now, it’s all just noise—tariffs, trade wars, the usual. But I see a buying opportunity. One thing I’ve always noticed about the market: headlines change every few months.",0.92
1juaq8e,2025-04-08 10:56:54,https://www.reddit.com/r/Bitcoin/comments/1juaq8e/dutchspeaking_bitcoin_maximalists_community/,Dutch-speaking Bitcoin maximalists community,0,0,"Are you a Bitcoiner who prefers discussing Bitcoin in Dutch? We’ve created a dedicated subreddit for Dutch-speaking Bitcoiners who believe in BTC as the future of money. No altcoins, no distractions—just pure Bitcoin discussions, market analysis, and technical insights.

If you’re looking for a place to connect with like-minded Bitcoiners in the Dutch language, join us!

https://www.reddit.com/r/BitcoinMaximalistenNL/s/loAFvKXnLi",0.5
1juahpu,2025-04-08 10:41:50,https://i.redd.it/sx0di2ysalte1.png,I created this Bitcoin Dollar Cost Averaging calculator so that you can easily compare how a consistent Bitcoin investment strategy stacks up against the S&P 500 and gold over time,151,12,"To use it just enter your investment amount, select your investment frequency(weekly, bi-weekly, or monthly) and set your desired time period. 

The calculator analyzes historical price data to show you how much Bitcoin you would have accumulated and the total amount invested. It’s an easy way to compare a consistent strategy against trying to time the market.

[https://newhedge.io/bitcoin/dollar-cost-averaging-calculator](https://newhedge.io/bitcoin/dollar-cost-averaging-calculator)",0.96
1ju7xu0,2025-04-08 07:33:21,https://i.redd.it/9s61jg1mdkte1.png,Where money?? 😭😭😭,2633,115,,0.98
1ju7w1y,2025-04-08 07:29:40,https://i.redd.it/g9xf3o9ockte1.jpeg,Might need to stay in the job for another cycle (or two)!,343,7,"Time of getting in late at work is over, now full focus again. 

Stay humble and stack sats. ",0.97
1ju6s67,2025-04-08 06:09:39,https://www.reddit.com/r/Bitcoin/comments/1ju6s67/daily_discussion_april_08_2025/,"Daily Discussion, April 08, 2025",25,125,"Please utilize this sticky thread for all general **Bitcoin** discussions! If you see posts on the front page or /r/Bitcoin/new which are better suited for this daily discussion thread, please help out by directing the OP to this thread instead. Thank you!

If you don't get an answer to your question, you can try phrasing it differently or commenting again tomorrow.

Please check the [previous discussion thread](https://www.reddit.com/r/Bitcoin/comments/1jtff92/mentor_monday_april_07_2025_ask_all_your_bitcoin/) for unanswered questions.",0.86
1ju4o1s,2025-04-08 03:55:19,https://i.redd.it/dw3oflppajte1.png,Bitcoin evolution chart up to 04/08/2025.,55,10,"This image reflects the concept that Bitcoin only falls upwards, it goes up two steps, goes down one, stagnates...This image reflects the concept that Bitcoin only falls upwards, it goes up two steps, goes down one, stagnates...it goes up two steps, goes down one, stagnates...
When we say ""it's not time to buy Bitcoin yet"" this sentence actually doesn't make sense, because there is always time to buy Bitcoin.",0.77
1ju4e49,2025-04-08 03:39:07,https://www.reddit.com/r/Bitcoin/comments/1ju4e49/what_is_the_best_bitcoin_book/,What is the best Bitcoin book?,18,28,"If you could only choose 2 books to read for the rest of your life about Bitcoin, what would they be?",0.81
1jtycxp,2025-04-07 22:35:09,https://www.reddit.com/r/Bitcoin/comments/1jtycxp/i_need_my_iphone_repaired_with_blue_wallet_on_it/,I need my iphone repaired with blue wallet on it...,2,1,"Hello

my iphone needs repair. and the repair guy says he needs my iphone passcode to make sure everything is working and to test everything. Issue is i have some important apps like Bluewallet on it, even thou my Blue wallet has password.  I was wondering what is the risk they can open my wallet, if they have my iphone passcode? i hold some Bitcoin on my bluewallet for easy access usually. also it acts as a read only wallet for my hardware wallets too. 

so i dont really want to uninstall the wallet from my phone. is bluewallet's password alone, enough? 

Thank you",1.0
1ju452m,2025-04-08 03:24:58,https://www.reddit.com/r/Bitcoin/comments/1ju452m/how_to_buy_btc_without_kyc/,How to buy BTC without KYC.,2,4,"Buy any stable coin (preferably the one from your currency, in my case BRL - Brazilian Money - ) that is on the Liquid Network (The privacy Chain where all transactions are confidential and where you can buy L-BTC) and transfer the stable coin to a wallet that allows swaps (search on Google any wallet you trust).

Swap your stable coin on Liquid Network to L-BTC. Since you bought the stable coin already inside the Liquid Network and transactions are confidential, the last thing anyone knows (including the government) is that you bought a stable coin version of your currency (which means no one can say you had any gains over time because of the 1:1 ratio stable coins have).

Then peg-out to BTC (search on Google how to do that). And done. You're good to go, you're the only person in the whole world that knows your stable coins were swaped to L-BTC and then turned into BTC.

And of course: Never sell your Bitcoin. Don't do this if you're a paper hand, it will be useless doing all that if you're gonna sell every time price drops a little.


",0.56
1ju1v79,2025-04-08 01:25:32,https://v.redd.it/qyn7ccyyjite1,Bitcoin Ad,571,37,"Idk who made it, but if you know please source them! Found on X! ",0.96
1ju18w0,2025-04-08 00:53:55,https://www.reddit.com/r/Bitcoin/comments/1ju18w0/regarding_various_state_bitcoin_reserve_funds/,Regarding various State Bitcoin Reserve Funds.,0,0,"First let me say I'm a longer term holder of bitcoin since 2012. I fully believe in Bitcoin, but the wording of some of these state reserve bills gives me a small, but hesitant pause in the purpose of these bills.

Firstly [Executive Order 14233](https://www.federalregister.gov/executive-order/14233)

Section 3 (a)

""The Secretary of the Treasury shall establish an office to administer and maintain control of custodial accounts collectively known as the “Strategic Bitcoin Reserve,” capitalized with all BTC held by the Department of the Treasury that was finally forfeited as part of criminal or civil asset forfeiture proceedings or in satisfaction of any civil money penalty imposed by any executive department or agency (agency) and that is not needed to satisfy requirements under [31 U.S.C. 9705](https://www.govinfo.gov/link/uscode/31/9705) or released pursuant to subsection (d) of this section (Government BTC).""

I'm no expert on all the language, but this order seems to be focused on seized assets. Why specifically call this out? does this give them authority to eventually seize Bitcoin like they did gold in the 70's?

Why not just specifically create a reserve and not include this language.  31 U.S.C. 9705 is a Department of the Treasury Forfeiture Fund indicating that this could be seized and used for other purposes.

Other State bills such as Arizona's SB1373 state the following.

""THE DIGITAL ASSETS STRATEGIC RESERVE FUND IS ESTABLISHED CONSISTING OF MONIES APPROPRIATED BY THE LEGISLATURE AND DIGITAL ASSETS THAT ARE SEIZED BY THIS STATE.""

Again why this language? There are other bills with similar language, but I have not spent enough time to find them all.

BTW. I believe the bill in Arizona has passed the regular sessions and just needs to be signed or Vetoed by the governor now, which is exciting.

Utah recently passed their bitcoin reserve bill, but I believe they amended the section about investing into the fund last min, which is disappointing. [https://bitcoinnews.com/adoption/utah-bitcoin-reserve-bill-change/](https://bitcoinnews.com/adoption/utah-bitcoin-reserve-bill-change/)

Overall I think bitcoin will continue on and thrive, but some of this language has me concerned of the true intentions in the background.

Anyone with knowledge in this area could share their thoughts on this ?

 

  
",0.4
1ju0xn4,2025-04-08 00:37:50,https://i.redd.it/ff22c14cbite1.png,"In the long term, all fiat trends to dust vs. BTC",53,4,,0.85
1ju0qs0,2025-04-08 00:27:46,https://www.reddit.com/r/Bitcoin/comments/1ju0qs0/prior_investor_thinking_of_jumping_back_in/,Prior investor thinking of jumping back in...,0,15,"Just like everyone I see the opportunity ahead.

But I am also not buying in yet (I have zero investments currently) and I think every needs to hear me out and consider why.

First of all, this is only a slight downturn so far. So far like 20-30% loss. That's nothing compared to previous dips. It's too damn early. If I was invested I'm taking out every dime I had for at least a week. You are being irresponsible if you aren't doing this. 

This problem isn't ""magically"" going away. If the tariffs were cancelled tomorrow, prices will only rise so far, we aren't missing out on actual growth till things become stable...

And that is the issue, there is zero stability right now and it's gonna get only worse. 

It doesn't matter your politics, people on the right/center/left all agree on a crash.

People on the right have the best case scenario of ""we need this short term crash to fix the economy"".. well IF THIS IS THE BEST CASE SCENARIO, STOP PLAYING HODL AND GET THE F OUT FOR A FEW WEEKS!

BTC was at 60k literally 6 months ago. Go wait and buy back in then if you like the best case scenario.

Problem is, 60k BTC isn't a crash. The economy wouldn't be hurting much for 60k BTC to exist. It will probably be at 60k within 2 weeks. 

The right wing keeps saying you need the economy to hurt a bit in order to strong arm everyone into deals in order to declare a trade victory. Well the last time the economy was hurting was 2022, and BTC was in the teens and 20s then, 70% off it's all time high. This means best case scenario is a 70% drop, so BTC is in the 40s.

I will consider buying once it is below 50k, but will probably wait until it's a bit lower.. I don't see it going down to covid levels of under 10k but it'll probably hit either 19k or 29k as a bottom out point. 

I plan on buying in at those levels. To be honest anything above 40k feels expensive right now. ",0.21
1ju0loc,2025-04-08 00:20:45,https://www.reddit.com/r/Bitcoin/comments/1ju0loc/be_greedy_when_the_others_are_fearful_is_just/,Be greedy when the others are fearful is just that simple,93,29,Isn’t it so easy guys? Why do you always find a way to overcomplicate things.. ,0.89
1ju0cka,2025-04-08 00:08:21,https://www.reddit.com/r/Bitcoin/comments/1ju0cka/is_really_tiring_to_explain_why_you_should_invest/,Is really tiring to explain why you should invest now. Stop the non sense of thinking it goes lower..,16,53,Guys if it’s to buy is now. Not in 6 months because you thought would go lower.. ,0.62
1ju09br,2025-04-08 00:03:51,https://v.redd.it/yufpupxb5ite1,For More Bitcoin Mining Content Check Out The Build-a-Mine Podcast on YouTube!,0,0,,0.4
1jtzisf,2025-04-07 23:28:46,https://www.reddit.com/r/Bitcoin/comments/1jtzisf/newbie/,Newbie,8,12,Newbie here. What are your guys thoughts on starting out doing $20-$30 a week investment into bitcoin to start?,0.79
1jtzc3y,2025-04-07 23:20:08,https://www.reddit.com/r/Bitcoin/comments/1jtzc3y/when_transferring_to_hardware_wallet_do_you/,"When transferring to hardware wallet, do you always use a different BTC address or always the same one? Why or why not?",5,20,HI all - just curious here.  Do you guys change the address each time a transfer is made?,0.67
1jtyzwz,2025-04-07 23:04:35,https://www.reddit.com/r/Bitcoin/comments/1jtyzwz/local_open_source_blockchain_analysis_software/,Local open source blockchain analysis software,0,1,"Are there any programs for running blockchain analysis locally on a device running a full node? I have seen plenty of web based applications, but I’m looking to be able to set notifications for movement within certain wallets and run persistent, automated analyses at a fine grained level. ",0.33
1jtyu9r,2025-04-07 22:57:26,https://www.reddit.com/r/Bitcoin/comments/1jtyu9r/thinking_about_taking_out_a_personal_loan_for_the/,Thinking about taking out a personal loan for the dip,0,30,Anyone else wanna buy the dip in a bit way?!?,0.44
1jtylm6,2025-04-07 22:46:16,https://www.reddit.com/r/Bitcoin/comments/1jtylm6/what_this_greenhorn_learned_today/,What this greenhorn learned today,6,1,"- Notable dips will reveal when you have invested more than you're capable of losing
- Dips due to economic crisis compound with fear of recession and losing one's job
- Not leaving dry powder on hand for a tasty dip is depressing and can make you invest more than you should
- Fear of not investing enough before it moves the new bottom, forever, is rough, and needs to be let go of
- Alt coins, even ones you truly believe in, dip hard AF and should be well accepted before even thinking about investing
- ADHD makes all of the above, even harder.

It's almost like I learned to just DCA, like literally everyone says...

Bonus thing I learned. At least 90% of reddit posts on crypto add emotional burden, skew reality, and motivate crap decisions. No offense, but most of you have been bad for my financial decision making and sanity. I think I'm going to take a hiatus while we're going through this mess, so I can fully embrace my DCA.",0.67
1jtyk7a,2025-04-07 22:44:28,https://i.redd.it/ap0w6xa9rhte1.png,Antminer U1,1,1,"Found this in a box of random stuff I bought. Does anyone still use the tiny little thing anymore? Also could there be bitcoin on the hard drives!? 🤔 lol
",0.55
1jtydyt,2025-04-07 22:36:31,https://www.reddit.com/r/Bitcoin/comments/1jtydyt/initial_investment_versus_current_market_question/,Initial investment versus current market question,0,3,"I have been fortunate enough to have had invested in bitcoin in 2021 2022… I understand that it wasn’t the hottest time in the history but still comparing to the current market price. I have accumulated pretty nice gains.

What I am very concerned about is my attitude toward the market fluctuation. I am in this for a long run. Don’t get me wrong. I haven’t touched my stash ever since I started collecting it. 

My question is, how do you navigate around the market based on the investment you made and the return you can get. 

Like, at what point will you freak out that your initial investment is nearing the current sales price? And what percentage away from the current sales price versus your original purchase price would you find yourself to be alert and trying to strategize what to do next?

but I’m lying. I am in this for a long game, but at the same time taking the current world state I am not sure if I should rather have some gold or cash instead? ",0.38
1jtxo1i,2025-04-07 22:03:28,https://www.reddit.com/r/Bitcoin/comments/1jtxo1i/help_wanted_libertarian_cyberpunks/,Help Wanted Libertarian Cyberpunks!,1,0,"I need help designing a very simple GUI and code for an extension within bitcoin. I am looking for people who have extreme experience coding and understand bitcoin protocol more than me. I need trusted software developers who want to revolutionize how bitcoin is used. If you have a vast amount of knowledge about the satoshi papers, bypassing governmental IP blocks and the differences between on chain and off chain please comment below so we can connect. ",1.0
1jtxjnm,2025-04-07 21:58:25,https://www.reddit.com/r/Bitcoin/comments/1jtxjnm/best_platforms_for_dca/,Best platforms for DCA?,0,4,Best as in lowest fees and whatnot. Would it make sense to buy $5 a day?,0.38
1jtwqr4,2025-04-07 21:23:00,https://www.reddit.com/r/Bitcoin/comments/1jtwqr4/bitcoin_core_only_legacy_wallets_are_supported_by/,Bitcoin Core: Only legacy wallets are supported by this command (code -4),0,3,"So im trying to import a legacy private key into Bitcoin Core v28.1.0 using importprivkey and Im getting an error I have never seen before,  Only legacy wallets are supported by this command (code -4)

From my understanding I should not be getting this error as the PK Im trying to import is coming from a legacy 1 address, I have done this process a million times and im at a loss.  ",0.4
1jtwpqs,2025-04-07 21:21:43,https://www.reddit.com/r/Bitcoin/comments/1jtwpqs/a_btc_question_on_safely_storing_your_currency/,A BTC Question on Safely Storing Your Currency,0,11,"Allow me to set my stage please.

Let us assume that Bitcoin has become a functioning currency and that the USA has adopted it as their official currency.

Each person is responsible for their own wallet.  Each citizen has not given ultimate control of their personal Btc holdings over to another party.

Essentially each person keeps their private key in their own home whether it’s written down somewhere or memorized or whatever.

How would you envision this working out?  Example I know such and such a person has a decent amount on hand.  

How does he safely secure his btc while not becoming a target.  One can assume that there is btc in every home.  Is it safe for one to keep stacks of cash in their home?

How do you envision society working on my made up stage?

Edited for personal info and the following.

I am assuming that handing over btc to a central authority such as a bitcoin bank would defeat the entire idea of btc.",0.4
1jtw6zg,2025-04-07 20:59:57,https://i.redd.it/gl0ubrrl8hte1.jpeg,The show must go on. Who’s with me!!,221,23,,0.89
1jtvpzl,2025-04-07 20:40:43,https://www.reddit.com/r/Bitcoin/comments/1jtvpzl/well_i_think_we_might_just_find_out_who_satoshi_is/,Well I think we might just find out who Satoshi is !,0,8,Crypto attorney sues Department of Homeland Security to uncover the identity/identities of Satoshi.https://www.google.com/amp/s/www.theblock.co/amp/post/349851/crypto-attorney-sues-department-of-homeland-security-to-uncover-the-identity-of-bitcoin-creator-satoshi-nakamoto ,0.22
1jtvm08,2025-04-07 20:36:06,https://i.redd.it/bcl8n8w34hte1.png,Now Is The Best Time To Consolidate Your UTXOs,19,4,Title says it. Bitcoin fees are at an all time low in terms of sats/vB. Quickly seize this opportunity before it's too late.,0.83
1jttz9d,2025-04-07 19:29:55,https://www.reddit.com/r/Bitcoin/comments/1jttz9d/question_for_long_term_hodlers_is_this_kinda/,Question for long term HODLers -- is this kinda normal for bitcoin?,25,74,"I understand the volatility. I get that it does 10% or more moves in a day. But what is happening now (with the macro environment, wars etc) is unprecedented. In this environment, shouldn't bitcoin be way more volatile? Isn't it a good sign that we've not crashed to $50k?

I was orange pilled only a year ago, and I'm very excited about the long term prospects of bitcoin, but also nervous about the short term. Any words of advice will be appreciated!",0.69
1jttkef,2025-04-07 19:13:15,https://i.redd.it/0hplxnpkpgte1.jpeg,Still have hope 🤞🏽,156,4,,0.95
