ID,Timestamp,URL,Title,Score,Comments,Text,Upvote Ratio
1jod3xr,2025-03-31 20:22:34,https://www.reddit.com/r/Bitcoin/comments/1jod3xr/why_bitcoin_is_still_on_track/,Why Bitcoin is Still on Track,79,31,"With Bitcoin pulling back and tariffs fear creeping in, some are calling for an early cycle top. But take a step back really, there are no clear signs that we’re heading into a recession or a true market breakdown. If the macro structure holds, BTC is still on track for a cycle top later this year. 

Why This Isn’t a Macro Breakdown (Yet)

1. Tariffs as a Temporary Hurdle
	•	Leverage, Not a Permanent Shock:
Tariffs often serve as a negotiation tool rather than a lasting economic barrier. As talks progress, these fears could subside, similar to past trade disputes.

2. Inflation Is Stable
	•	No signs of a 2022-style inflation spiral that would force the Fed to tighten aggressively.
	•	The Fed can still ease later this year—which is what typically fuels Bitcoin’s late-cycle parabolic runs.

3. Unemployment Is Fine
	•	No major labor market weakness → No imminent recession.
	•	Bitcoin’s worst crashes happen when unemployment spikes and liquidity dries up—that’s not happening right now.

4. Bitcoin Follows Traditional Cycle Timing
	•	Historically, BTC cycles peak after the halving, usually in Q4, not Q1. 
	•	2017: BTC topped in December.
	•	2021: BTC double-topped in Q4.
	•	2024? The structure is still intact unless macro conditions break down.

5. The Key Risks: Inflation & Unemployment Surprises
	•	If inflation reaccelerates, the Fed might delay rate cuts—bad for risk assets.
	•	If unemployment spikes, liquidity dries up.
	•	But until then, there’s no reason to assume Bitcoin has already peaked.

Bitcoin’s Likely Path from Here
	•	Short-term shakeout → Consolidation → Final leg up into Q4 (unless inflation/unemployment forces a macro shift).
	•	This pullback looks eerily similar to mid-cycle corrections in 2017 and 2021 before the final blow-off top.

If inflation stays tame and the job market holds, expect BTC to reverse and continue its cycle as planned. ",0.85
1jocil5,2025-03-31 19:58:36,https://www.reddit.com/r/Bitcoin/comments/1jocil5/risk_of_6102_on_centralized_exchanges_and_etfs_to/,Risk of 6102 on centralized exchanges and ETFs to form SBR?,5,2,"Nonzero chance especially considering how much the government cares about you and your safety. 

Probably hold your own keys just in case? Or plan a nice boat trip 🚣‍♂️ ",0.78
1joc21x,2025-03-31 19:40:12,https://i.redd.it/iwxhxadnv2se1.jpeg,BLACKROCK just sad the quiet part OUT LOUD in their recent shareholder letter 🤫,1617,79,full letter by Larry Fink : [https://www.blackrock.com/corporate/investor-relations/larry-fink-annual-chairmans-letter](https://www.blackrock.com/corporate/investor-relations/larry-fink-annual-chairmans-letter),0.96
1joarjg,2025-03-31 18:47:12,https://i.redd.it/mt6ej6ejm2se1.png,"Rhode Island Bill Would Allow State Residents Spend $10,000 Monthly In Bitcoin Tax Free",524,63,,0.98
1joak9t,2025-03-31 18:38:59,https://i.redd.it/xlxbuzs2l2se1.jpeg,Not a single on-chain market indicator for BTC cycle top has been hit yet… Just sayin.,444,121,,0.94
1jo95yb,2025-03-31 17:42:40,https://www.reddit.com/gallery/1jo95yb,Satoshi Nakamoto toys created with AI. We honor his contribution to the cryptocurrency and financial revolution.,0,5,,0.49
1jo91yb,2025-03-31 17:38:12,https://i.redd.it/by05fgi8a2se1.jpeg,Holding Fiat Costs More Than You Think,111,47,"If you have $83K and held it for 10 years, that $83K in USD would have to be worth $111K — at only 3% inflation.

That’s $28K lost in buying power just for holding fiat.

However, if you bought BTC at 83k, it could be worth 2x, 5x or 10x more than what you bought it for. 

BTC is deflationary and the hardest currency ever made. 
",0.85
1jo8khd,2025-03-31 17:18:55,https://www.reddit.com/r/Bitcoin/comments/1jo8khd/tapsigner_is_on_discount/,Tapsigner is on discount,18,2,"I just noticed that Tapsigner is on discount. $19,99 instead of $39,99

  
[https://store.coinkite.com/store/category/cards](https://store.coinkite.com/store/category/cards) ",0.95
1jo81lq,2025-03-31 16:57:58,https://i.redd.it/1dv8pd3232se1.jpeg,Bitcoin Policy Institute releases a framework for the USA to buy $200 billion worth of Bitcoin using Bit Bonds,97,16,,0.96
1jo6zov,2025-03-31 16:14:07,https://x.com/saylor/status/1902823899131171310,21 truths of bitcoin - Saylor,1,0,,0.56
1jo6ygr,2025-03-31 16:12:42,https://www.youtube.com/watch?v=BOUvYupUGKM,Vancouver Mayor Ken Sim: “Adopting Bitcoin Is My Duty” (new podcast),61,9,,0.91
1jo60dd,2025-03-31 15:33:11,https://www.reddit.com/r/Bitcoin/comments/1jo60dd/just_moved_from_ledger_to_seedsigner/,Just moved from ledger to SeedSigner,24,23,"So, I just moved out from ledger nano s plus to SeedSigner and maybe this post can influence and make some people think outside of the box for a moment. 

Why moving? Well, Ledger is a big company, and the more I read about it, more it makes me think that they're not so interested on privacy or security it self. They're more worried about convenience for their users... But convenience has its price (Security). If you don't know what I'm talking about, think for a second about their Recovery Service, that just stores your private key on their servers. That said, does it means its insecure and has a backdoor? Who knows, maybe... but if you're storing your life savings you should do it with the most secure device you can get, right? 

I think SeedSigner is the absolute best for people stacking bitcoin for the long run, and its the easiest and cheapest way in my opinion to hop in for a super secure device.

Let me know what you guys think",0.81
1jo5jcl,2025-03-31 15:12:57,https://www.reddit.com/r/Bitcoin/comments/1jo5jcl/you_are_not_bullish_enough/,You are not bullish enough,1,0,"[Exclusive | The Trump Family Advances Its All-Out Crypto Blitz, This Time With Bitcoin Mining - WSJ](https://www.wsj.com/finance/currencies/the-trump-family-advances-its-all-out-crypto-blitz-this-time-with-bitcoin-mining-86a1e8d9?mod=hp_lead_pos9)

ChatGPT-generated summary: Eric Trump and Donald Trump Jr. are partnering with bitcoin miner Hut 8 to launch ""American Bitcoin,"" aiming to build the world's largest bitcoin-mining operation. They will hold a 20% stake, while Hut 8 contributes mining equipment for an 80% share. This move aligns with the Trump family's broader push into cryptocurrency, seeking to position the U.S. as a global crypto leader.",0.67
1jo59gt,2025-03-31 15:01:16,https://i.redd.it/y5zz0ve8i1se1.jpeg,105 connections,28,6,"Start your own bitcoin node with bitcoin core

https://bitcoin.org/en/bitcoin-core/

Make sure to enable port forwarding for port 8333 on your router

I use a travel router that allows me to run a VPN from it’s firmware

https://www.amazon.com/dp/B09N72FMH5

NordVPN will not port forward 8333 without a travel router.
",0.87
1jo4rvw,2025-03-31 14:40:18,https://v.redd.it/a8uqjjwhe1se1,Bitcoin is worth studying,187,3,,0.98
1jo49mr,2025-03-31 14:17:56,https://i.redd.it/ktn3ci7ia1se1.jpeg,BlackRock CEO warns dollar at risk of losing world reserve currency status to Bitcoin,0,0,,0.5
1jo3u7n,2025-03-31 13:59:08,https://www.reddit.com/r/Bitcoin/comments/1jo3u7n/does_anyone_know_how_otc_buying_works/,Does anyone know how OTC buying works?,28,21,"I'm curious because if Saylor has bought over 500,000 BTC by himself and other institutions are also buying large amounts OTC, when can we expect a supply squeeze? I know the sales are private and between whales, but it feels like there's an unlimited supply of OTC or something. Anyone else feel this way?",0.82
1jo3aux,2025-03-31 13:33:50,https://www.reddit.com/r/Bitcoin/comments/1jo3aux/what_does_he_want/,What does he want?,0,16,"Just curious, what does Michael want with all that BTC?

He become too big to fail at some point, no government would potentially allow a single soul to own more than them in future.

I mean, it’s good he buys it, but at some point he must utilize it somehow? Will he sell it to other governments in future, if so for what?

Wouldn’t he be a target to any group to get kidnapped?

Man, what do you want Michael?",0.39
1jo39ju,2025-03-31 13:32:06,https://v.redd.it/ij9o35ta21se1,The 2021 bitcoin bull market was suppressed. This parabolic bull market begins once U.S. Treasury Secretary Scott Bessent successfully “releverages the U.S. banking system.” Nobody is bullish enough.,154,5,,0.89
1jo30pg,2025-03-31 13:20:18,https://www.reddit.com/r/Bitcoin/comments/1jo30pg/moonpay_cant_sell_bitcoin/,Moonpay can’t sell bitcoin,12,3,"Downloaded moonpay, on the app there was no verification process. So I bought some bitcoin but now when I try to sell the bitcoin it says “missing balance account. You need to create a moonpay balance account to continue” but I’ve searched literally everywhere there is nothing on the app that says anything about a balance account and how to get one? any1 know what to do ",0.93
1jo2k9v,2025-03-31 12:57:57,https://www.reddit.com/r/Bitcoin/comments/1jo2k9v/how_are_bitcoin_etfs_banksinstitutions_a_good/,How are Bitcoin ETF's & Banks/Institutions a good thing?,1,24,"Satoshi states in the white paper that bitcoin is supposed to serve as a peer-to-peer, decentralised digital currency without the need for banks.

Nobody even uses bitcoin for peer-to-peer transactions, they just buy & hold (or sell later). It's treated like an investment more than anything. It's used to be pretty prominent in the dark web, but other crypto currencies have taken over.

How does this not undermine it's core function? And reason for creation?

Banks, institutions & governments are buying bitcoin by the thousands, with estimates predicting that they will own the majority of circulating bitcoin within a decade.

It seems like the government, banks & institutions came to the understanding that it's not feasibly possible to ""kill"" bitcoin, but by simply adopting bitcoin, they actually directly threaten it's very reason for existing, without the average bitcoin enthusiast even realising. And many even supporting it.

That's what confuses me about the pro-institutional adoption crowd. 

You have to ask yourself: What is bitcoin's utility? Why is bitcoin worth something? What are the long term consequences of large scale institutional adoption?

",0.53
1jo2ebl,2025-03-31 12:49:27,https://www.reddit.com/gallery/1jo2ebl,Your Daily Bitcoin Breakdown newsletter is now live. Check out today’s Top Stories and a sneak peek at the latest Quick Bits snippets. Full issue link is in the comments.,32,4,,0.87
1jo2ar4,2025-03-31 12:44:25,https://www.reddit.com/r/Bitcoin/comments/1jo2ar4/gdp_in_gold_value/,GDP in gold value,6,1,"would it not be better to look at GDP indexed to gold prices and not dollar prices?

GDP Growth in Gold Terms (2015–2025)

* USA: -3.0% per year
* UK: -5.8% per year
* Japan: -8.0% per year
* China: -3.1% per year
* India: -1.0% per year

  
Source - [Analysis by GROK](https://grok.com/share/bGVnYWN5_400266c6-d296-401b-9553-d592efd727ad)",0.8
1jo1ty9,2025-03-31 12:19:50,https://www.reddit.com/r/Bitcoin/comments/1jo1ty9/bear/,Bear,0,15,Are we officially in bearmarket?,0.39
1jo17ws,2025-03-31 11:45:29,https://v.redd.it/a1sm664bj0se1,CONGRESSMAN BEGICH SAYS THE USA WILL BE BUYING 1 MILLION BITCOIN SOON,945,172,,0.92
1jo12wk,2025-03-31 11:36:57,https://i.redd.it/ihsfxwuoh0se1.png,r/bitcoin is showing no signs of slowing down. Up and to the right we go.,209,50,,0.89
1jo0mub,2025-03-31 11:08:24,https://v.redd.it/qvph7iloc0se1,Using Magic 🪄 to acquire more Bitcoin,121,4,,0.91
1jo0efu,2025-03-31 10:53:30,https://www.reddit.com/r/Bitcoin/comments/1jo0efu/how_do_you_talk_about_btc_in_public/,How do you talk about BTC in public?,0,65,"I’ve been caught in a difficult situation lately. I feel a strong urge to educate others and spark meaningful conversations about bitcoin, yet I am really wary and nervous about discussing it openly. Reading all those cautionary tales and unsettling stories makes me wonder if sharing my passion might someday backfire. I worry that in five to ten years, when bitcoin reaches new heights, I could become a target for a 5$ wrench attack or unwanted attention simply because people know I have bitcoin. This inner conflict between the desire to share what I believe in and the fear of potential future repercussions is something I struggle with a lot.",0.47
1jnzwi3,2025-03-31 10:19:10,https://www.reddit.com/gallery/1jnzwi3,Latest Coinbase Scam,86,28,"Friendly reminder to always check the sender and never trust, only verify! I started reading this email and it almost had me fooled until I got to the part where they put the seed phrase in the body of the email 🤣

Here is the seed btw in case someone more capable than I can scoop whatever before the scammers:

seat december laugh distance climb digital very material actress physical system whale",0.91
1jnyttd,2025-03-31 08:59:40,https://i.redd.it/broo0hknpzre1.png,Can You See It?,439,36,,0.87
1jny2gp,2025-03-31 07:58:26,https://www.reddit.com/r/Bitcoin/comments/1jny2gp/lets_turn_bitcoin_pizza_day_legacy_into_global/,Let’s turn Bitcoin Pizza Day Legacy into Global Pizza Day 2025!,1,0,"Hey r/bitcoin community! We're evolving Bitcoin Pizza Day into something bigger - Global Pizza Day - a celebration that unites all cryptocurrency communities while honoring Laszlo's historic 10,000 BTC pizza purchase.

That $41 transaction (now worth $830+ million) wasn't just Bitcoin history - it's the origin story for all cryptocurrency. It proved digital money could work, established Bitcoin's real value, and gave us the perfect way to explain crypto to newcomers.

For the 15th anniversary in 2025, Global Pizza Day will bring together all crypto communities - from Bitcoin maximalists to DeFi developers - using pizza as our universal language. This isn't replacing Bitcoin Pizza Day - it's expanding it to welcome everyone in the crypto ecosystem.

You can participate by: celebrating at home, joining online, hosting/attending events, creating content, or supporting the initiative. Our hub at pizza.day will connect global celebrations.

We need r/bitcoin's help to make May 22, 2025 the largest crypto celebration ever. Visit pizza.day, share your ideas, spread the word, and start planning. The 10,000 BTC pizza purchase didn't just make history - it created the foundation for everything that followed.

Will you join us? ",1.0
1jnxfo1,2025-03-31 07:08:14,https://peakd.com/hive-167922/@uyobong/california-pioneers-bitcoin-rights-with-amended-digital-assets-bill-jpn,California Pioneers Bitcoin Rights with Amended Digital Assets Bill,1,0,"California Assemblyman Avelino Valencia introduced amendments to Assembly Bill 1052 (AB 1052), originally the “Money Transmission Act,” rebranding it as the “Digital Assets” bill to secure Bitcoin and cryptocurrency rights for the state’s 39.4 million residents.
",1.0
1jnxfi9,2025-03-31 07:07:52,https://www.reddit.com/r/Bitcoin/comments/1jnxfi9/mentor_monday_march_31_2025_ask_all_your_bitcoin/,"Mentor Monday, March 31, 2025: Ask all your bitcoin questions!",10,15,"Ask (and answer!) away! Here are the general rules:

* If you'd like to learn something, ask.
* If you'd like to share knowledge, answer.
* Any question about Bitcoin is fair game.

And don't forget to check out /r/BitcoinBeginners

You can sort by new to see the latest questions that may not be answered yet.",0.81
1jnwjl4,2025-03-31 06:02:08,https://www.reddit.com/r/Bitcoin/comments/1jnwjl4/daily_discussion_march_31_2025/,"Daily Discussion, March 31, 2025",34,118,"Please utilize this sticky thread for all general **Bitcoin** discussions! If you see posts on the front page or /r/Bitcoin/new which are better suited for this daily discussion thread, please help out by directing the OP to this thread instead. Thank you!

If you don't get an answer to your question, you can try phrasing it differently or commenting again tomorrow.

Please check the [previous discussion thread](https://www.reddit.com/r/Bitcoin/comments/1jn673g/daily_discussion_march_30_2025/) for unanswered questions.",0.92
1jnv6zo,2025-03-31 04:30:57,https://www.reddit.com/r/Bitcoin/comments/1jnv6zo/dollar_debasement_btcs_largest_catalyst/,Dollar debasement = BTC's largest catalyst?,1,0,"Just want to start off by saying I am not an American citizen / so non-aligned to Democrats or Republicans.. but all that has happened since the start of the Trump presidency will actually result in US$ debasement. Think of it - allies are being scorned and scowled at, tariffs are and will be inflationary, all that DOGE is doing is cutting people's jobs: guess what happens when people lose jobs? they stop spending.. but hey thanks to tariffs' -> inflation inches up. 

We all have been waiting for a few catalysts like rate cuts / institutional adoption of BTC and loss of belief in the fiat. But all of that is being achieved in short time by the loss of faith in the US$.

In short - this loss of faith in the US$ could end up being the biggest driver to BTC. Keep buying the dips and power to the people.",1.0
1jnv0ub,2025-03-31 04:20:03,https://i.redd.it/awc2ty5ubyre1.jpeg,Once you get it you cant get enough,330,35,,0.97
1jnutee,2025-03-31 04:07:14,https://www.reddit.com/r/Bitcoin/comments/1jnutee/exploring_bitcoins_proof_of_work_in_typescript/,Exploring Bitcoin's Proof of Work in TypeScript,26,3,"Hi everyone,

I’ve put together a video that walks through a simplified TypeScript implementation of Bitcoin’s Proof of Work consensus mechanism. In the video, I break down block header construction, double SHA256 hash calculations, and the mining process itself. It’s a humble effort to demystify the inner workings of Bitcoin mining and show how these core concepts secure the network.

If you’re curious about the nuts and bolts of Bitcoin’s security model, I hope you enjoy the video and find the GitHub source code useful!

[YouTube Video](https://youtu.be/8sEgdwIFXWA)  
[Source Code](https://github.com/radzionc/crypto)
",0.88
1jnug27,2025-03-31 03:45:32,https://i.redd.it/te6iwmwn5yre1.jpeg,You’re not bullish enough on BTC,84,15,,0.9
1jnufgk,2025-03-31 03:44:36,https://www.reddit.com/r/Bitcoin/comments/1jnufgk/export_bitcoin_transactions/,Export Bitcoin Transactions?,6,3,"I've tried for the life of me to find a way to export Bitcoin transactions from various online Bitcoin transaction explorers, but I just can't find a site that does it. Plenty of explorers show block and transaction history but none seem to offer an export. What am I missing? This seems like it should be so obvious and simple. Thanks in advance.",0.8
1jnu67t,2025-03-31 03:29:34,https://www.reddit.com/r/Bitcoin/comments/1jnu67t/new_to_bitcoin_in_canada/,New to bitcoin in Canada,0,13,"Hi, as the title says i am new to bitcoin. What are the best ways to buy bitcoin in canada with lowest fees. I know it can’t be without fees, but what are my options. Currently i have found bitget to be one option, but p2p being the only sane option, i cant find a way to dca weekly, are there options like swam or strike here in Canada? 

Thanks in advance for helping me out",0.5
1jnty7d,2025-03-31 03:16:48,https://www.reddit.com/r/Bitcoin/comments/1jnty7d/ekm4life/,Ekm4life,2,3,"I was ripped off by crypto.com and I'm needing some guidance to where I can get help to hold them accountable. Where do I go, what do I and who do I report them to?",0.56
1jnty05,2025-03-31 03:16:28,https://www.reddit.com/r/Bitcoin/comments/1jnty05/how_paynyms_are_generated/,How PayNyms are generated.,3,0,"I understand payment codes and I understand the hashing into the avatar. I want to know how the short, easy to remember, unique name is created from the payment code. Every article says it's a hashing algorithm. I have not found any documentation on how that works. Does anyone have a technical doc or a search term to explain?",0.67
1jntfi5,2025-03-31 02:47:16,https://www.reddit.com/r/Bitcoin/comments/1jntfi5/could_it_be_that_bitcoin_will_habe_no_value/,Could it be that Bitcoin will habe no value somewhen in the future?,0,16,"If you think yes, then how far in the future, do you think B is most likely to reach 0?",0.44
1jnsgiv,2025-03-31 01:53:40,https://i.redd.it/lmd6ny9olxre1.png,Expert analyses for Bitcoin,3,3,How do we respond without sounding mad?,1.0
1jnpzyg,2025-03-30 23:43:13,https://www.reddit.com/r/Bitcoin/comments/1jnpzyg/new_to_bitcoin/,New to Bitcoin,19,21,"I’m new to Bitcoin and I’ve done my research, it looks amazing. I want a way to hold money so that the banks don’t have control over it and Bitcoin seems like the go to. I’ve never invested in Bitcoin and I’m wondering if now would be the perfect moment to invest? I’m not looking into short term (I don’t care about the fluctuations it’s normal until more than 90% gets mined) but like very long term investment (10years at least). Any tips on where to buy it (less fees) and where to safely store it? 

Any help would be greatly appreciated! ",0.78
1jnpz7g,2025-03-30 23:42:11,https://youtu.be/JMjRqoTU_pk?si=S1wtKmPHtUiYZZqG,Bitcoin in 2025: TOO LATE or Still Early? Here's The FACTS!,0,5,,0.44
1jnp49k,2025-03-30 23:00:11,https://i.redd.it/jzy250xupwre1.png,Google BTC chart is broken,202,55,"Interesting... Google chart for BTC is broken.

The price at the top says ""83,825"" and shows the date as March-28 (the current date is March-30), but the chart itself is accurate as of right now.  Even using a different computer, and using Incognito mode, Google still shows the same March-28 date and price.",0.89
1jnosf5,2025-03-30 22:44:16,https://www.reddit.com/r/Bitcoin/comments/1jnosf5/what_if_ms_sold_all_their_btc_at_once/,What if MS sold all their BTC at once?,0,17,"I mean MicroStrategy ofc not Michael Saylor's personal stack. We are talking about billions of BTC. ,would that crash the price of BTC big time and how to what extend?
 Also that the top 1% of Bitcoin addresses hold over 90% of the total Bitcoin supply do you consider that a risk?",0.44
1jnoli0,2025-03-30 22:35:00,https://www.reddit.com/r/Bitcoin/comments/1jnoli0/if_bitcoins_have_a_scent_what_would_it_smell_like/,"If bitcoins have a scent, what would it smell like?",0,46,"It's for a gag gift, but I would like some input on this. I know it can't smell like cash or gold, but maybe some sort of metallic/beach, metalic/newcar, etc.

Something that potentially doesn't smell good, but makes sense with BTC

Thanks everyone

EDIT: (Thank you for the comments)",0.35
1jnognu,2025-03-30 22:28:29,https://www.reddit.com/r/Bitcoin/comments/1jnognu/will_you_ever_own_one_whole_bitcoin/,Will you ever own one whole Bitcoin?,3,13,"I made a simple calculator to see if you will ever reach one bitcoin. It uses how much you already own, how much you regularly invest and your estimate for bitcoins growth. Try it here. [https://bitcoinstackr.com/](https://bitcoinstackr.com/)

Lmk what features i should add.",0.57
1jno4md,2025-03-30 22:12:46,https://www.reddit.com/r/Bitcoin/comments/1jno4md/i_think_bull_run_is_over_more_opportunity_i_guess/,I think bull run is over. More opportunity I guess.,0,61,"Been buying and putting 90% of my paycheck in it for a few years.
I was hoping for a more dramatic, blowoff top type of PA but ngl it has been anticlimactic and disappointing (so far). Many would argue its the most disappointing bull run. 
Not selling and I see these drops as opportunity but ngl, I was hoping for more this cycle.

Ill come back to this post a few weeks from now to see if I were right or if this dip was just a small dip before back to 90k and 100k...

EDIT: Looks like it's headed for a deep correction or basically start to a bear market. I'll come back to this again in a few weeks",0.45
1jnnz26,2025-03-30 22:05:43,https://www.reddit.com/r/Bitcoin/comments/1jnnz26/just_chillllll/,Just chillllll,524,138,"PSA: With only 950k bitcoin to be mined between now and the END of the 2032 halving in 2036, if you’re worried about the price. It will catch up eventually if you’re thinking in terms of fiat still. Strategy has bought 500k since 2020. Before Blackrock or World governments had even started to think about it. Stop watching the regards on X and YouTube with their ridiculous and baseless predictions.  The End",0.9
1jnnbt5,2025-03-30 21:36:41,https://www.wfaa.com/article/news/crime/no-charges-for-two-men-with-250k-in-gold-bars-but-north-texas-authorities-will-keep-their-gold/287-88cfdb7f-1a5e-4d1c-9519-6738ef3f782f,Wouldn't have had a problem with 12 words,19,4,Just sayin,0.71
1jnmvk3,2025-03-30 21:16:16,https://i.redd.it/nt8oh5z48wre1.png,Time for consolidation,95,5,The mempool is empty. Now is a good time for consolidation.,0.95
1jnmu5y,2025-03-30 21:14:36,https://www.dailystar.co.uk/news/latest-news/woman-accidentally-bins-3m-bitcoin-34960920,Woman accidentally bins £3m Bitcoin fortune in 'worst mistake ever',545,111,,0.92
1jnm4f9,2025-03-30 20:43:31,https://www.reddit.com/r/Bitcoin/comments/1jnm4f9/im_pretty_new_and_have_a_question/,Im pretty new and have a question.,10,36,"Hello, I have read that BTC is going to be rising in this years late or 2026??? But I don't understand how BTC really rises it's value. Should I really buy BTC whenever I hit my salary? And wait for a year or two to sell? 
I absolutely have no clue about bitcoin and would like to learn a lot. ",0.67
1jnkr7b,2025-03-30 19:44:57,https://i.redd.it/8epp0iwvrvre1.png,Why is mempool queue empty? Blocks are not full?,18,6,,0.91
1jnk1pd,2025-03-30 19:13:50,https://i.redd.it/65l6ugsdmvre1.jpeg,.,9,0,,0.85
1jnjlp0,2025-03-30 18:54:46,https://www.reddit.com/r/Bitcoin/comments/1jnjlp0/buying_btc_no_kyc/,buying btc no kyc,3,18,is there any website or exchange I can buy btc with just my debit card without kyc,0.59
